{
    "mdb_source_id": "mdb-src-gtfs-london-transit-commission-ca",
    "name": "London Transit Commission",
    "location": "London, Ontario",
    "country_code": "CA",
    "bounding_box": {
        "minimum_latitude": 42.905244,
        "maximum_latitude": 43.051188,
        "minimum_longitude": -81.36311,
        "maximum_longitude": -81.137591,
        "extracted_on": "2022-02-01T17:20:21+00:00"
    },
    "data_type": "gtfs",
    "urls": {
        "auto_discovery": "http://www.londontransit.ca/gtfsfeed/google_transit.zip",
        "license": "https://www.londontransit.ca/open-data/ltcs-open-data-terms-of-use/",
        "latest": "https://storage.googleapis.com/storage/v1/b/archives_latest/o/mdb-src-gtfs-london-transit-commission-ca.zip?alt=media"
    }
}